{
  "$schema": "https://json-schema.org/draft/2020-12/schema",
  "$id": "https://f150-garage-assistant.local/schema/component.schema.json",
  "title": "Component",
  "type": "object",
  "required": [
    "id",
    "schemaVersion",
    "entityType",
    "knowledgeScope",
    "name",
    "systemId",
    "description"
  ],
  "properties": {
    "id": {
      "type": "string",
      "pattern": "^[a-z0-9][a-z0-9._-]*$"
    },
    "schemaVersion": {
      "type": "integer",
      "minimum": 1
    },
    "entityType": {
      "const": "component"
    },
    "knowledgeScope": {
      "enum": [
        "generic",
        "vehicle_specific",
        "configuration_specific"
      ]
    },
    "status": {
      "enum": [
        "draft",
        "verified",
        "deprecated"
      ]
    },
    "createdAt": {
      "type": [
        "string",
        "null"
      ],
      "format": "date-time"
    },
    "updatedAt": {
      "type": [
        "string",
        "null"
      ],
      "format": "date-time"
    },
    "name": {
      "type": "string"
    },
    "systemId": {
      "type": "string"
    },
    "aliases": {
      "type": "array",
      "items": {
        "type": "string"
      }
    },
    "description": {
      "type": "string"
    },
    "purpose": {
      "type": "string"
    },
    "location": {
      "type": "array",
      "items": {
        "type": "string"
      }
    },
    "normalConditions": {
      "type": "array",
      "items": {
        "type": "string"
      }
    },
    "failureIndicators": {
      "type": "array",
      "items": {
        "type": "string"
      }
    },
    "inspectionIds": {
      "type": "array",
      "items": {
        "type": "string"
      },
      "uniqueItems": true
    },
    "procedureIds": {
      "type": "array",
      "items": {
        "type": "string"
      },
      "uniqueItems": true
    },
    "diagnosticIds": {
      "type": "array",
      "items": {
        "type": "string"
      },
      "uniqueItems": true
    },
    "mediaIds": {
      "type": "array",
      "items": {
        "type": "string"
      },
      "uniqueItems": true
    },
    "safetyRuleIds": {
      "type": "array",
      "items": {
        "type": "string"
      },
      "uniqueItems": true
    },
    "referenceIds": {
      "type": "array",
      "items": {
        "type": "string"
      },
      "uniqueItems": true
    },
    "specifications": {
      "type": "array",
      "items": {
        "type": "object",
        "required": [
          "value",
          "unit",
          "source"
        ],
        "properties": {
          "value": {},
          "unit": {
            "type": "string"
          },
          "condition": {
            "type": [
              "string",
              "null"
            ]
          },
          "source": {
            "type": "object",
            "required": [
              "referenceIds",
              "verificationStatus"
            ],
            "properties": {
              "referenceIds": {
                "type": "array",
                "items": {
                  "type": "string"
                },
                "uniqueItems": true
              },
              "verificationStatus": {
                "enum": [
                  "verified",
                  "partially_verified",
                  "unverified",
                  "unknown"
                ]
              },
              "verifiedAt": {
                "type": [
                  "string",
                  "null"
                ],
                "format": "date-time"
              },
              "verificationNotes": {
                "type": "string"
              }
            },
            "additionalProperties": false
          }
        },
        "additionalProperties": false
      }
    }
  },
  "additionalProperties": false
}
